{
  "$schema": "https://json-schema.org/draft/2020-12/schema",
  "$id": "https://scan.yearn.dev/contracts/submission-v1",
  "title": "Yearn Scan submission v1",
  "description": "Runtime validation also checks calendar correctness, finished_at >= started_at, URL parsing and credential exclusion. This schema is a repository artifact, not a public Worker route.",
  "type": "object",
  "additionalProperties": false,
  "required": [
    "schema_version",
    "run_id",
    "repository",
    "commit_sha",
    "scan_type",
    "scanner",
    "started_at",
    "finished_at",
    "status",
    "severity_counts",
    "report_url"
  ],
  "properties": {
    "schema_version": {
      "const": 1
    },
    "run_id": {
      "type": "string",
      "minLength": 1,
      "maxLength": 128,
      "pattern": "^[a-zA-Z0-9][a-zA-Z0-9._:-]*$"
    },
    "repository": {
      "type": "string",
      "maxLength": 140,
      "pattern": "^[a-zA-Z0-9][a-zA-Z0-9-]{0,38}/(?!\\.{1,2}$)[a-zA-Z0-9_.-]{1,100}$"
    },
    "commit_sha": {
      "type": "string",
      "pattern": "^[a-fA-F0-9]{40}$"
    },
    "ref": {
      "anyOf": [
        {
          "type": "string",
          "minLength": 1,
          "maxLength": 255,
          "pattern": "^[^\\u0000-\\u001f\\u007f]+$"
        },
        {
          "type": "null"
        }
      ]
    },
    "pr_number": {
      "type": [
        "integer",
        "null"
      ],
      "minimum": 1,
      "maximum": 9007199254740991
    },
    "scan_type": {
      "type": "string",
      "minLength": 1,
      "maxLength": 64,
      "pattern": "^[a-z][a-z0-9]*(?:-[a-z0-9]+)*$"
    },
    "scanner": {
      "type": "object",
      "additionalProperties": false,
      "required": [
        "name",
        "version"
      ],
      "properties": {
        "name": {
          "type": "string",
          "minLength": 1,
          "maxLength": 128,
          "pattern": "^[^\\u0000-\\u001f\\u007f]+$"
        },
        "version": {
          "type": "string",
          "minLength": 1,
          "maxLength": 128,
          "pattern": "^[^\\u0000-\\u001f\\u007f]+$"
        }
      }
    },
    "ai_model": {
      "anyOf": [
        {
          "type": "string",
          "minLength": 1,
          "maxLength": 128,
          "pattern": "^[^\\u0000-\\u001f\\u007f]+$"
        },
        {
          "type": "null"
        }
      ]
    },
    "started_at": {
      "type": "string",
      "format": "date-time",
      "pattern": "^\\d{4}-\\d{2}-\\d{2}T\\d{2}:\\d{2}:\\d{2}(?:\\.\\d{3})?Z$"
    },
    "finished_at": {
      "type": [
        "string",
        "null"
      ],
      "format": "date-time",
      "pattern": "^\\d{4}-\\d{2}-\\d{2}T\\d{2}:\\d{2}:\\d{2}(?:\\.\\d{3})?Z$"
    },
    "status": {
      "enum": [
        "running",
        "completed",
        "failed"
      ]
    },
    "severity_counts": {
      "type": "object",
      "additionalProperties": false,
      "required": [
        "critical",
        "high",
        "medium",
        "low",
        "info"
      ],
      "properties": {
        "critical": {
          "type": [
            "integer",
            "null"
          ],
          "minimum": 0,
          "maximum": 9007199254740991
        },
        "high": {
          "type": [
            "integer",
            "null"
          ],
          "minimum": 0,
          "maximum": 9007199254740991
        },
        "medium": {
          "type": [
            "integer",
            "null"
          ],
          "minimum": 0,
          "maximum": 9007199254740991
        },
        "low": {
          "type": [
            "integer",
            "null"
          ],
          "minimum": 0,
          "maximum": 9007199254740991
        },
        "info": {
          "type": [
            "integer",
            "null"
          ],
          "minimum": 0,
          "maximum": 9007199254740991
        }
      }
    },
    "report_url": {
      "type": [
        "string",
        "null"
      ],
      "format": "uri",
      "maxLength": 4096,
      "pattern": "^https://[^\\s\\\\@/?#]+(?:[/?#][^\\s\\\\]*)?$"
    },
    "pr_url": {
      "type": [
        "string",
        "null"
      ],
      "format": "uri",
      "maxLength": 4096,
      "pattern": "^https://[^\\s\\\\@/?#]+(?:[/?#][^\\s\\\\]*)?$"
    },
    "pr_title": {
      "type": [
        "string",
        "null"
      ],
      "minLength": 1,
      "maxLength": 512,
      "pattern": "^[^\\u0000-\\u001f\\u007f]+$"
    }
  },
  "allOf": [
    {
      "if": {
        "properties": {
          "scan_type": {
            "const": "ai-pr"
          }
        }
      },
      "then": {
        "required": [
          "pr_number"
        ],
        "properties": {
          "pr_number": {
            "type": "integer",
            "minimum": 1,
            "maximum": 9007199254740991
          }
        }
      }
    }
  ]
}
