{
  "schema_version": 1,
  "run_id": "example-ci-12345-ai-pr",
  "repository": "yearn/tokenized-strategy",
  "commit_sha": "0123456789abcdef0123456789abcdef01234567",
  "ref": "refs/pull/123/head",
  "pr_number": 123,
  "scan_type": "ai-pr",
  "scanner": {
    "name": "review-agent",
    "version": "1.0.0"
  },
  "ai_model": "example-model",
  "started_at": "2026-09-17T09:00:00.000Z",
  "finished_at": null,
  "status": "running",
  "severity_counts": {
    "critical": null,
    "high": null,
    "medium": null,
    "low": null,
    "info": null
  },
  "report_url": null,
  "pr_title": "Improve strategy accounting",
  "pr_url": "https://github.com/yearn/tokenized-strategy/pull/123"
}
